{
  "$schema": "../schemas/trainer-roster.schema.json",
  "schema_version": 1,
  "asset_policy": {
    "rct_source": "https://gitlab.com/srcmc/rct/mod/-/tree/1.21.1/common/src/main/resources/assets/rctmod/textures/trainers/single",
    "distribution": "dependency_reference",
    "states": {
      "verified": "RCT 공식 텍스처 연결 또는 프로젝트 내부 제작 스킨 파일을 확인함",
      "definition_only": "Cobbleverse 데이터 ZIP에 트레이너 정의는 있으나 대응 텍스처 파일은 확인되지 않음",
      "missing": "캐릭터 항목만 준비했으며 독자 제작 스킨 또는 사용 허가가 필요함"
    }
  },
  "battle_reference_defaults": [
    { "character": "cobbleventure:character/brock", "entry": "another_red_brock_001" },
    { "character": "cobbleventure:character/misty", "entry": "another_red_misty_001" },
    { "character": "cobbleventure:character/lt_surge", "entry": "another_red_surge_001" },
    { "character": "cobbleventure:character/erika", "entry": "another_red_erika_001" },
    { "character": "cobbleventure:character/koga", "entry": "rct_kanto_koga" },
    { "character": "cobbleventure:character/sabrina", "entry": "another_red_sabrina_001" },
    { "character": "cobbleventure:character/blaine", "entry": "another_red_blaine_001" },
    { "character": "cobbleventure:character/giovanni_gym", "entry": "another_red_giovanni_001" },
    { "character": "cobbleventure:character/falkner", "entry": "another_red_falkner_001" },
    { "character": "cobbleventure:character/bugsy", "entry": "another_red_bugsy_001" },
    { "character": "cobbleventure:character/morty", "entry": "another_red_morty_001" },
    { "character": "cobbleventure:character/chuck", "entry": "another_red_chuck_001" },
    { "character": "cobbleventure:character/jasmine", "entry": "another_red_jasmine_001" },
    { "character": "cobbleventure:character/clair", "entry": "another_red_clair_001" },
    { "character": "cobbleventure:character/roxanne", "entry": "another_red_roxane_001" },
    { "character": "cobbleventure:character/brawly", "entry": "another_red_brawly_001" },
    { "character": "cobbleventure:character/wattson", "entry": "another_red_wattson_001" },
    { "character": "cobbleventure:character/flannery", "entry": "another_red_flannery_001" },
    { "character": "cobbleventure:character/norman", "entry": "another_red_norman_001" },
    { "character": "cobbleventure:character/winona", "entry": "another_red_winoa_001" },
    { "character": "cobbleventure:character/tate", "entry": "another_red_tate_001" },
    { "character": "cobbleventure:character/liza", "entry": "another_red_liza_001" }
  ],
  "organizations": [
    {
      "id": "cobbleventure:organization/team_rocket", "display_name": { "ko_kr": "로켓단", "en_us": "Team Rocket" }, "generations": [1, 2], "regions": ["kanto", "johto"],
      "grunt_variants": [
        { "id": "cobbleventure:character/team_rocket_grunt_male", "display_name": { "ko_kr": "로켓단 조무래기 (남)", "en_us": "Team Rocket Grunt (Male)" }, "role": "grunt", "gender": "male", "generation": 1, "region": "kanto", "appearance": { "source": "custom", "type": "skin", "resource": "cobbleventure:trainer_skin/team_rocket_grunt_male", "implementation_status": "ready", "asset_status": "verified", "visual_match_status": "matched", "distribution": "third_party_attributed" } },
        { "id": "cobbleventure:character/team_rocket_grunt_female", "display_name": { "ko_kr": "로켓단 조무래기 (여)", "en_us": "Team Rocket Grunt (Female)" }, "role": "grunt", "gender": "female", "generation": 1, "region": "kanto", "appearance": { "source": "custom", "type": "skin", "resource": "cobbleventure:trainer_skin/team_rocket_grunt_female", "implementation_status": "ready", "asset_status": "verified", "visual_match_status": "matched", "distribution": "third_party_attributed" } }
      ],
      "named_characters": [
        { "id": "cobbleventure:character/giovanni", "display_name": { "ko_kr": "비주기", "en_us": "Giovanni" }, "role": "boss", "gender": "male", "generation": 1, "region": "kanto", "appearance": { "source": "rct_single", "type": "skin", "resource": "rctmod:trainers/single/boss_giovanni_0045", "implementation_status": "ready", "asset_status": "verified", "distribution": "dependency_reference" } },
        { "id": "cobbleventure:character/archer", "display_name": { "ko_kr": "아처", "en_us": "Archer" }, "role": "admin", "gender": "male", "generation": 2, "region": "johto", "appearance": { "source": "rct_single", "type": "skin", "resource": "rctmod:trainers/single/rocket_admin_archer_002a", "implementation_status": "ready", "asset_status": "verified", "distribution": "dependency_reference" } },
        { "id": "cobbleventure:character/ariana", "display_name": { "ko_kr": "아리아나", "en_us": "Ariana" }, "role": "admin", "gender": "female", "generation": 2, "region": "johto", "appearance": { "source": "rct_single", "type": "skin", "resource": "rctmod:trainers/single/rocket_admin_ariana_0029", "implementation_status": "ready", "asset_status": "verified", "distribution": "dependency_reference" } },
        { "id": "cobbleventure:character/proton", "display_name": { "ko_kr": "프로톤", "en_us": "Proton" }, "role": "admin", "gender": "male", "generation": 2, "region": "johto", "appearance": { "source": "custom", "type": "skin", "resource": "cobbleventure:trainer_skin/proton", "implementation_status": "ready", "asset_status": "verified", "visual_match_status": "matched", "distribution": "original_required" } },
        { "id": "cobbleventure:character/petrel", "display_name": { "ko_kr": "페트렐", "en_us": "Petrel" }, "role": "admin", "gender": "male", "generation": 2, "region": "johto", "appearance": { "source": "custom", "type": "skin", "resource": "cobbleventure:trainer_skin/petrel", "implementation_status": "ready", "asset_status": "verified", "visual_match_status": "matched", "distribution": "original_required" } }
      ]
    },
    {
      "id": "cobbleventure:organization/team_aqua", "display_name": { "ko_kr": "아쿠아단", "en_us": "Team Aqua" }, "generations": [3], "regions": ["hoenn"],
      "grunt_variants": [
        { "id": "cobbleventure:character/team_aqua_grunt_male", "display_name": { "ko_kr": "아쿠아단 조무래기 (남)", "en_us": "Team Aqua Grunt (Male)" }, "role": "grunt", "gender": "male", "generation": 3, "region": "hoenn", "appearance": { "source": "custom", "type": "skin", "resource": "cobbleventure:trainer_skin/team_aqua_grunt_male", "implementation_status": "ready", "asset_status": "verified", "visual_match_status": "matched", "distribution": "third_party_attributed" } },
        { "id": "cobbleventure:character/team_aqua_grunt_female", "display_name": { "ko_kr": "아쿠아단 조무래기 (여)", "en_us": "Team Aqua Grunt (Female)" }, "role": "grunt", "gender": "female", "generation": 3, "region": "hoenn", "appearance": { "source": "custom", "type": "skin", "resource": "cobbleventure:trainer_skin/team_aqua_grunt_female", "implementation_status": "ready", "asset_status": "verified", "visual_match_status": "matched", "distribution": "third_party_attributed" } }
      ],
      "named_characters": [
        { "id": "cobbleventure:character/archie", "display_name": { "ko_kr": "아강", "en_us": "Archie" }, "role": "boss", "gender": "male", "generation": 3, "region": "hoenn", "appearance": { "source": "custom", "type": "skin", "resource": "cobbleventure:trainer_skin/archie", "implementation_status": "ready", "asset_status": "verified", "visual_match_status": "matched", "distribution": "third_party_attributed" } },
        { "id": "cobbleventure:character/matt", "display_name": { "ko_kr": "해조", "en_us": "Matt" }, "role": "admin", "gender": "male", "generation": 3, "region": "hoenn", "appearance": { "source": "custom", "type": "skin", "resource": "cobbleventure:trainer_skin/matt", "implementation_status": "ready", "asset_status": "verified", "visual_match_status": "matched", "distribution": "original_required" } },
        { "id": "cobbleventure:character/shelly", "display_name": { "ko_kr": "이연", "en_us": "Shelly" }, "role": "admin", "gender": "female", "generation": 3, "region": "hoenn", "appearance": { "source": "custom", "type": "skin", "resource": "cobbleventure:trainer_skin/shelly", "implementation_status": "ready", "asset_status": "verified", "visual_match_status": "matched", "distribution": "original_required" } }
      ]
    },
    {
      "id": "cobbleventure:organization/team_magma", "display_name": { "ko_kr": "마그마단", "en_us": "Team Magma" }, "generations": [3], "regions": ["hoenn"],
      "grunt_variants": [
        { "id": "cobbleventure:character/team_magma_grunt_male", "display_name": { "ko_kr": "마그마단 조무래기 (남)", "en_us": "Team Magma Grunt (Male)" }, "role": "grunt", "gender": "male", "generation": 3, "region": "hoenn", "appearance": { "source": "custom", "type": "skin", "resource": "cobbleventure:trainer_skin/team_magma_grunt_male", "implementation_status": "ready", "asset_status": "verified", "visual_match_status": "matched", "distribution": "third_party_attributed" } },
        { "id": "cobbleventure:character/team_magma_grunt_female", "display_name": { "ko_kr": "마그마단 조무래기 (여)", "en_us": "Team Magma Grunt (Female)" }, "role": "grunt", "gender": "female", "generation": 3, "region": "hoenn", "appearance": { "source": "custom", "type": "skin", "resource": "cobbleventure:trainer_skin/team_magma_grunt_female", "implementation_status": "ready", "asset_status": "verified", "visual_match_status": "matched", "distribution": "third_party_attributed" } }
      ],
      "named_characters": [
        { "id": "cobbleventure:character/maxie", "display_name": { "ko_kr": "마적", "en_us": "Maxie" }, "role": "boss", "gender": "male", "generation": 3, "region": "hoenn", "appearance": { "source": "custom", "type": "skin", "resource": "cobbleventure:trainer_skin/maxie", "implementation_status": "ready", "asset_status": "verified", "visual_match_status": "matched", "distribution": "third_party_attributed" } },